hotel_id,name,hotel_link
0,Khách sạn Minasi HanoiOi Hà Nội,https://www.ivivu.com/khach-san-ha-noi/hanoioi-hotel
1,Khách sạn Pullman Hà Nội,https://www.ivivu.com/khach-san-ha-noi/pullman-hanoi
2,Khách sạn Flower Garden Hà Nội,https://www.ivivu.com/khach-san-ha-noi/khach-san-flower-garden-ha-noi
3,Khách sạn The Chi Boutique Hà Nội,https://www.ivivu.com/khach-san-ha-noi/khach-san-the-chi-ha-noi
4,Khách sạn A25 - 30 An Dương Hà Nội,https://www.ivivu.com/khach-san-ha-noi/a25-hotel-an-duong
5,Khách sạn Meliá Hà Nội,https://www.ivivu.com/khach-san-ha-noi/khach-san-melia-ha-noi
6,Khách sạn Apricot Hà Nội,https://www.ivivu.com/khach-san-ha-noi/khach-san-apricot-ha-noi
7,Khách sạn FTE Ba Đình Hà Nội,https://www.ivivu.com/khach-san-ha-noi/khach-san-fte-ba-dinh-ha-noi
8,Khách sạn Reyna Luxury Hà Nội,https://www.ivivu.com/khach-san-ha-noi/reyna-luxury-hotel
9,Khách sạn Sen Grand Hotel & Spa Hà Nội,https://www.ivivu.com/khach-san-ha-noi/sen-grand-hotel-spa-managed-by-sen-group
10,Khách sạn Conifer Grand Hà Nội,https://www.ivivu.com/khach-san-ha-noi/conifer-grand-hotel
11,Khách sạn Mường Thanh Grand Hà Nội,https://www.ivivu.com/khach-san-ha-noi/khach-san-muong-thanh-grand-ha-noi
12,Khách sạn Roygent Parks Hà Nội,https://www.ivivu.com/khach-san-ha-noi/roygent-parks-hanoi
13,Khách sạn Azumaya Kim Mã 2,https://www.ivivu.com/khach-san-ha-noi/khach-san-azumaya-kim-ma-2
14,Tru by Hilton Hà Nội Station,https://www.ivivu.com/khach-san-ha-noi/khach-san-tru-by-hilton-ha-noi-station
15,Khách sạn Authentic Hà Nội Boutique,https://www.ivivu.com/khach-san-ha-noi/authentic-hanoi-boutique-hotel
16,Khách Sạn SaiGon Aroma Hà Nội,https://www.ivivu.com/khach-san-ha-noi/khach-san-saigon-aroma
17,Khách sạn Sen Luxury Hà Nội,https://www.ivivu.com/khach-san-ha-noi/sen-hotel-2
18,Khách sạn 22Land Residence Hà Nội - Nguyễn Đình Hoàn,https://www.ivivu.com/khach-san-ha-noi/22land-residence-hotel-2
19,Khách sạn Gloud Hà Nội,https://www.ivivu.com/khach-san-ha-noi/gloud-hotel
20,Khách sạn Chalcedony Hà Nội,https://www.ivivu.com/khach-san-ha-noi/chalcedony-hotel
21,Khách sạn Sen Hà Nội,https://www.ivivu.com/khach-san-ha-noi/sen-hotel
22,Khách sạn 22Land Residence Hà Nội - 50 Trương Công Giai,https://www.ivivu.com/khach-san-ha-noi/22land-residence-ha-noi
23,Khách sạn M Village Thợ Nhuộm Hà Nội,https://www.ivivu.com/khach-san-ha-noi/khach-san-m-village-hotel-tho-nhuom-ha-noi
24,Khách sạn Canary Hà Nội,https://www.ivivu.com/khach-san-ha-noi/khach-san-canary-ha-noi
25,Le Jardin Hotel & Spa Hà Nội,https://www.ivivu.com/khach-san-ha-noi/hanoi-le-jardin-hotel-spa
26,Khách sạn Le Jardin Haute Couture Hà Nội,https://www.ivivu.com/khach-san-ha-noi/le-jardin-hotel-haute-couture
27,Khách sạn Dusit Le Palais Từ Hoa Hà Nội,https://www.ivivu.com/khach-san-ha-noi/khach-san-dusit-le-palais-tu-hoa-ha-noi
28,Khu căn hộ Fraser Suites Hà Nội,https://www.ivivu.com/khach-san-ha-noi/fraser-suites-ha-noi
29,Khu căn hộ Somerset Hòa Bình Hà Nội,https://www.ivivu.com/khach-san-ha-noi/somerset-hoa-binh-ha-noi
30,Khu căn hộ Somerset West Point Hà Nội,https://www.ivivu.com/khach-san-ha-noi/somerset-west-point-ha-noi
31,Khách Sạn Solare De Monte Hotel & Spa Hà Nội,https://www.ivivu.com/khach-san-ha-noi/hotel-de-souriant-central-ha-noi
32,Khách sạn Novotel Suites Hà Nội,https://www.ivivu.com/khach-san-ha-noi/khach-san-novotel-suites-ha-noi
33,Khách sạn JW Marriott Hà Nội,https://www.ivivu.com/khach-san-ha-noi/khach-san-jw-marriott-ha-noi
34,Khách sạn Bespoke Trendy Hà Nội,https://www.ivivu.com/khach-san-ha-noi/ha-noi-bespoke-trendy-hotel
35,Wyndham Skylake Resort & Villas Hà Nội,https://www.ivivu.com/khach-san-ha-noi/wyndham-sky-lake-resort-villas-ha-noi
36,Khách sạn Grand Plaza Hà Nội,https://www.ivivu.com/khach-san-ha-noi/khach-san-grand-plaza-ha-noi
37,Khách sạn The Lapis Hà Nội,https://www.ivivu.com/khach-san-ha-noi/khach-san-the-lapis-ha-noi
38,Acoustic Hotel & Spa Hà Nội,https://www.ivivu.com/khach-san-ha-noi/acoustic-hotel-spa-ha-noi
39,Khách sạn Minasi Grand Hà Nội,https://www.ivivu.com/khach-san-ha-noi/minasi-hotel-spa
40,Khách sạn Silk Path Luxury Hà Nội,https://www.ivivu.com/khach-san-ha-noi/khach-san-silk-path-ha-noi
41,Khách sạn Pan Pacific Hà Nội,https://www.ivivu.com/khach-san-ha-noi/khach-san-pan-pacific-ha-noi
42,Khách sạn Peridot Grand Luxury Boutique Hà Nội,https://www.ivivu.com/khach-san-ha-noi/peridot-grand-hotel-spa
43,Hotel de l'Opera Hà Nội - MGallery,https://www.ivivu.com/khach-san-ha-noi/de-lopera-hanoi-mgallery-collection
44,Khách sạn Novotel Hà Nội Thái Hà,https://www.ivivu.com/khach-san-ha-noi/novotel-ha-noi-thai-ha
45,Khách sạn Victor Gallery Hotel & Spa Hà Nội,https://www.ivivu.com/khach-san-ha-noi/ha-noi-victor-gallery-hotel-spa
46,Khách sạn Grand Vista Hà Nội,https://www.ivivu.com/khach-san-ha-noi/khach-san-grand-vista-ha-noi
47,Khách sạn Grand Mercure Hà Nội,https://www.ivivu.com/khach-san-ha-noi/grand-mercure-hanoi
48,Khách sạn Signature by M Village Hà Nội,https://www.ivivu.com/khach-san-ha-noi/signature-by-m-village-ha-noi
49,Khách sạn Emerald Hà Nội,https://www.ivivu.com/khach-san-ha-noi/khach-san-emerald-ha-noi
50,Khách sạn Dal Vostro Valentino Hà Nội,https://www.ivivu.com/khach-san-ha-noi/dal-vostro-hotel-spa
51,Khách sạn La Siesta Premium Hàng Bè Hà Nội,https://www.ivivu.com/khach-san-ha-noi/la-siesta-premium-hang-be-ha-noi
52,La Sinfonía del Rey Hotel & Spa Hà Nội,https://www.ivivu.com/khach-san-ha-noi/la-sinfonia-del-rey-hotel-spa
53,Khách sạn Minasi Premium Hà Nội,https://www.ivivu.com/khach-san-ha-noi/minasi-premium-hotel
54,Khu căn hộ Somerset Grand Hà Nội,https://www.ivivu.com/khach-san-ha-noi/somerset-grand-ha-noi
55,Wil'que Westlake Hotel & Residences Hà Nội,https://www.ivivu.com/khach-san-ha-noi/somerset-west-lake-ha-noi
56,Khách sạn Champton Hà Nội,https://www.ivivu.com/khach-san-ha-noi/khach-san-the-light-ha-noi
57,Khách sạn Mercure Hà Nội La Gare,https://www.ivivu.com/khach-san-ha-noi/khach-san-mercure-ha-noi-la-gare
58,Khách sạn Thắng Lợi Hà Nội,https://www.ivivu.com/khach-san-ha-noi/khach-san-thang-loi-ha-noi
59,Khách sạn La Siesta Classic Mã Mây Hà Nội,https://www.ivivu.com/khach-san-ha-noi/hanoi-la-siesta-hotel-spa
60,Khách sạn Sheraton Hà Nội,https://www.ivivu.com/khach-san-ha-noi/khach-san-sheraton-ha-noi
61,Khách sạn Grand Cititel Hà Nội,https://www.ivivu.com/khach-san-ha-noi/khach-san-grand-cititel-ha-noi
62,Anise Hotel & Spa Hà Nội,https://www.ivivu.com/khach-san-ha-noi/anise-hanoi
63,Hà Nội Babylon Grand Hotel & Spa,https://www.ivivu.com/khach-san-ha-noi/hanoi-babylon-grand-hotel-spa
64,Khách sạn The Five Suites Lilas Hà Nội,https://www.ivivu.com/khach-san-ha-noi/khach-san-the-five-suites-lilas-ha-noi
65,Khách sạn Imperial Hà Nội,https://www.ivivu.com/khach-san-ha-noi/hanoi-imperial
66,Khách sạn Church Boutique 21 Hàng Cá Hà Nội,https://www.ivivu.com/khach-san-ha-noi/khach-san-church-boutique-21-hang-ca-ha-noi
67,Khách sạn Mia Hà Nội,https://www.ivivu.com/khach-san-ha-noi/khach-san-mia-ha-noi
68,Khách sạn Daewoo Hà Nội,https://www.ivivu.com/khach-san-ha-noi/khach-san-daewoo-ha-noi
69,Khách sạn Silk Path Boutique Hà Nội,https://www.ivivu.com/khach-san-ha-noi/khach-san-silk-path-boutique-ha-noi
70,Khách sạn Sunline Hà Nội,https://www.ivivu.com/khach-san-ha-noi/sunline-hotel
71,Khách sạn Hôtel du Parc Hà Nội,https://www.ivivu.com/khach-san-ha-noi/hotel-du-parc-hanoi
72,Khách sạn Hà Nội Starlight,https://www.ivivu.com/khach-san-ha-noi/hanoi-blue-sky-hotel-2
73,Khách sạn Especen Hà Nội,https://www.ivivu.com/khach-san-ha-noi/especen-hotel
74,Oriental Suites Hotel & Spa Hà Nội,https://www.ivivu.com/khach-san-ha-noi/khach-san-oriental-suites-hotel-spa-ha-noi
75,Khách sạn SQ Hàng Gai Hà Nội,https://www.ivivu.com/khach-san-ha-noi/khach-san-sq-hang-gai-ha-noi
76,Khách sạn A25 Phương Liệt Hà Nội,https://www.ivivu.com/khach-san-ha-noi/khach-san-a25-63a-phuong-liet
77,Khu nghỉ dưỡng Amour Ba Vì Hà Nội,https://www.ivivu.com/khach-san-ha-noi/khu-nghi-duong-amour-ba-vi-ha-noi
78,Khu căn hộ Daeha Hà Nội,https://www.ivivu.com/khach-san-ha-noi/daeha-ha-noi
79,Hanoi Solo Hotel,https://www.ivivu.com/khach-san-ha-noi/khach-san-maison-d-hanoi-boutique
80,Khách sạn Parkside Sunline Hà Nội,https://www.ivivu.com/khach-san-ha-noi/parkside-sunline-hotel
81,Khách sạn Fortuna Hà Nội,https://www.ivivu.com/khach-san-ha-noi/fortuna-hanoi-hotel
82,Khách sạn Wyndham Garden Hà Nội,https://www.ivivu.com/khach-san-ha-noi/khach-san-wyndham-garden-ha-noi
83,May De Ville Luxury Hotel & Spa Hà Nội - Gia Ngư,https://www.ivivu.com/khach-san-ha-noi/may-de-ville-old-quarter
84,Khách sạn One Hà Nội,https://www.ivivu.com/khach-san-ha-noi/khach-san-one-ha-noi
85,Khách sạn Thăng Long Opera Hà Nội,https://www.ivivu.com/khach-san-ha-noi/thang-long-opera-hotel
86,Esplendor Hotel & Spa Hà Nội,https://www.ivivu.com/khach-san-ha-noi/esplendor-hotel-spa-ha-noi
87,The Hà Nội Club Hotel & Lake Palais Residences,https://www.ivivu.com/khach-san-ha-noi/the-hanoi-club-hotel-lake-palais-residences-11781
88,Khách sạn Millennium Hà Nội,https://www.ivivu.com/khach-san-ha-noi/millennium-ha-noi
89,Hà Nội Boutique Hotel & Spa,https://www.ivivu.com/khach-san-ha-noi/hanoi-boutique-hotel-spa
90,Khách sạn The Ann Hà Nội,https://www.ivivu.com/khach-san-ha-noi/khach-san-the-ann-ha-noi
91,Lavender Central Hotel & Spa Hà Nội (tên cũ: Oriental Central),https://www.ivivu.com/khach-san-ha-noi/khach-san-oriental-central-ha-noi
92,Khách sạn Western Hà Nội,https://www.ivivu.com/khach-san-ha-noi/khach-san-western-ha-noi
93,Khách sạn The Pearl Hà Nội,https://www.ivivu.com/khach-san-ha-noi/khach-san-the-pearl-ha-noi
94,Khách sạn Halo Hà Nội,https://www.ivivu.com/khach-san-ha-noi/dai-duong-hotel-3
95,Tomodachi Retreat - Làng Mít Sơn Tây,https://www.ivivu.com/khach-san-ha-noi/tomodachi-retreat-lang-mit-son-tay
96,Khách sạn Diamond Westlake Suites Hà Nội,https://www.ivivu.com/khach-san-ha-noi/diamond-westlake-suites-ha-noi
97,Khách sạn TK123 Hà Nội,https://www.ivivu.com/khach-san-ha-noi/tk123-hanoi-hotel
98,Khách sạn Anatole Hà Nội,https://www.ivivu.com/khach-san-ha-noi/anatole-ha-noi
99,Khách sạn Hà Nội - Giảng Võ,https://www.ivivu.com/khach-san-ha-noi/ha-noi
100,Khách sạn Royal Hà Nội,https://www.ivivu.com/khach-san-ha-noi/khach-san-royal-ha-noi
101,Khách sạn Splendid Premium Hà Nội,https://www.ivivu.com/khach-san-ha-noi/silk-queen-grand-ha-noi
102,Khách sạn Super Candle Hà Nội,https://www.ivivu.com/khach-san-ha-noi/khach-san-super-candle-ha-noi
103,Khách sạn Sunway Hà Nội,https://www.ivivu.com/khach-san-ha-noi/khach-san-sunway-ha-noi
104,Khách sạn Soleil Boutique Hà Nội,https://www.ivivu.com/khach-san-ha-noi/soleil-boutique-ha-noi
105,Khách sạn Bảo Sơn International Hà Nội,https://www.ivivu.com/khach-san-ha-noi/khach-san-bao-son-international
106,Khách sạn La Beaute De Hà Nội,https://www.ivivu.com/khach-san-ha-noi/khach-san-la-beaute-de-ha-noi
107,Khách sạn Eden Hà Nội,https://www.ivivu.com/khach-san-ha-noi/eden-ha-noi-hotel
108,Beryl Palace Hotel & Spa Hà Nội,https://www.ivivu.com/khach-san-ha-noi/khach-san-angle-palace-ha-noi
109,La Belle Vie Hotel,https://www.ivivu.com/khach-san-ha-noi/la-belle-vie-hotel
110,Khách sạn La Casa Hà Nội,https://www.ivivu.com/khach-san-ha-noi/la-casa-hanoi-hotel
111,Hanoi Bella Rosa Hotel & Spa,https://www.ivivu.com/khach-san-ha-noi/bella-rosa-hotel
112,Khách sạn Luxury Old Quarter Hà Nội,https://www.ivivu.com/khach-san-ha-noi/luxury-old-quarter-hotel
113,Khách sạn Top Hà Nội,https://www.ivivu.com/khach-san-ha-noi/top-hotel-562080
114,Hà Nội Brilliant Hotel and Spa,https://www.ivivu.com/khach-san-ha-noi/hanoi-brilliant-hotel-and-spa
115,Khách sạn Royal Holiday Hà Nội,https://www.ivivu.com/khach-san-ha-noi/khach-san-royal-holiday-ha-noi
116,Aurora Premium Hotel & Spa Hà Nội,https://www.ivivu.com/khach-san-ha-noi/delicacy-central-hotel-spa
117,Khách sạn Hanoi Fiesta Central Hotel & Spa,https://www.ivivu.com/khach-san-ha-noi/khach-san-dahlia-ha-noi
118,Babylon Premium Hotel & Spa Hà Nội,https://www.ivivu.com/khach-san-ha-noi/babylon-premium-hotel-spa
119,Khách sạn Tirant Hà Nội,https://www.ivivu.com/khach-san-ha-noi/tirant
120,Khách sạn Eternity Hà Nội,https://www.ivivu.com/khach-san-ha-noi/eternity-hotel
121,Khách sạn Skyline Hà Nội,https://www.ivivu.com/khach-san-ha-noi/khach-san-skyline-ha-noi
122,Khách sạn Peridot Hà Nội,https://www.ivivu.com/khach-san-ha-noi/khach-san-delano-ha-noi
123,The Hanoian Central Hotel & Spa Hà Nội,https://www.ivivu.com/khach-san-ha-noi/the-hanoian-central-hotel-ha-noi
124,Khách sạn Royal St Hà Nội,https://www.ivivu.com/khach-san-ha-noi/khach-san-royal-st-ha-noi
125,Khách sạn A25 Trần Quốc Toản Hà Nội,https://www.ivivu.com/khach-san-ha-noi/khach-san-a25-tran-quoc-toan
126,Khách sạn A25 Hàng Nón Hà Nội,https://www.ivivu.com/khach-san-ha-noi/a25-hotel-hang-non
127,O'Gallery Premier Hotel & Spa Hà Nội,https://www.ivivu.com/khach-san-ha-noi/ogallery-premier-hotel-spa-ha-noi
128,Khách sạn Hướng Dương Hà Nội,https://www.ivivu.com/khach-san-ha-noi/khach-san-huong-duong-ha-noi
129,Khách sạn M Village Hồ Gươm Hà Nội,https://www.ivivu.com/khach-san-ha-noi/m-village-ho-guom
130,Khách sạn Splendid Holiday Hà Nội,https://www.ivivu.com/khach-san-ha-noi/splendid-holiday-ha-noi
131,Khách sạn Nesta Hà Nội,https://www.ivivu.com/khach-san-ha-noi-station/khach-san-nesta-ha-noi-1
132,Khách sạn Gondola Hà Nội,https://www.ivivu.com/khach-san-ha-noi/gondola-hanoi
133,Classy Holiday Hotel & Spa Hà Nội,https://www.ivivu.com/khach-san-ha-noi/classy-holiday-ha-noi
134,Khách sạn Nesta & Spa Hà Nội,https://www.ivivu.com/khach-san-ha-noi-station/khach-san-nesta-spa-ha-noi
135,Khu Căn Hộ Swiss-Belresidences Hà Nội,https://www.ivivu.com/khach-san-ha-noi/khu-can-ho-epic-tower-swiss-belresidences-ha-noi
136,Khách sạn Newstyle Hà Nội,https://www.ivivu.com/khach-san-ha-noi/newstyle-hanoi-hotel-apartment-44111721
137,Khách sạn Riverside Hanoi,https://www.ivivu.com/khach-san-ha-noi/khach-san-riverside-ha-noi
138,Khách sạn Bluebell Hà Nội,https://www.ivivu.com/khach-san-ha-noi/khach-san-bluebell-hotel-ha-noi
139,Khách sạn Hà Nội Pearl,https://www.ivivu.com/khach-san-ha-noi/hanoi-pearl-hotel
140,Khách sạn Flower,https://www.ivivu.com/khach-san-ha-noi/flower-66703
141,Khách sạn và Spa Quốc Hoa Premier,https://www.ivivu.com/khach-san-ha-noi/quoc-hoa-hanoi
142,Khách sạn & Spa Hồng Ngọc Dynastie Boutique,https://www.ivivu.com/khach-san-ha-noi/hong-ngoc-1
143,Khách sạn Aquarius Grand Hà Nội,https://www.ivivu.com/khach-san-ha-noi/hanoi-value
144,Maya Boutique Hotel & Spa Hà Nội,https://www.ivivu.com/khach-san-ha-noi/maya-boutique-hotel-spa
145,Khách sạn Lakeside Palace Hà Nội,https://www.ivivu.com/khach-san-ha-noi/golden-lake-185282
146,Khách sạn Lucky,https://www.ivivu.com/khach-san-ha-noi/lucky-1
147,Khách sạn Hà Nội Serendipity,https://www.ivivu.com/khach-san-ha-noi/vietface-hotel
148,Khách sạn và Spa Holiday Suites,https://www.ivivu.com/khach-san-ha-noi/holiday-diamond-hotel-221212
149,Khách sạn Capital Garden,https://www.ivivu.com/khach-san-ha-noi/capital-garden-hotel-hanoi
150,Khách sạn Rising Dragon Legend,https://www.ivivu.com/khach-san-ha-noi/rising-dragon-legend-hotel
151,La Dolce Vita,https://www.ivivu.com/khach-san-ha-noi/la-dolce-vita-private-enterprise
152,Khách sạn Âu Việt Hà Nội,https://www.ivivu.com/khach-san-ha-noi/khach-san-au-viet-ha-noi
153,La Beaute Boutique Hotel & Spa,https://www.ivivu.com/khach-san-ha-noi/khach-san-calypso-suites-ha-noi
154,Smile Hotel,https://www.ivivu.com/khach-san-ha-noi/khach-san-smile-ha-noi
155,Khách sạn Golden Sun Suites,https://www.ivivu.com/khach-san-ha-noi/khach-san-golden-sun-suites-ha-noi
156,Khách sạn Elite Hà Nội,https://www.ivivu.com/khach-san-ha-noi/khach-san-elite-ha-noi
157,Khách sạn Golden Sun Villa,https://www.ivivu.com/khach-san-ha-noi/khach-san-golden-sun-villa-ha-noi
158,Khách sạn Hanoi Golden Moon,https://www.ivivu.com/khach-san-ha-noi/khach-san-golden-moon-ha-noi
159,Khách sạn và Spa Hà Nội Paradise,https://www.ivivu.com/khach-san-ha-noi/khach-san-paradise-boutique-ha-noi
160,Khách Sạn và Spa Media Hà Nội,https://www.ivivu.com/khach-san-ha-noi/khach-san-meracus-ha-noi
161,Khách sạn Hà Nội Inner,https://www.ivivu.com/khach-san-ha-noi/khach-san-splendid-star-boutique-ha-noi
162,Khách sạn Hà Nội Rendezvous,https://www.ivivu.com/khach-san-ha-noi/khach-san-rendezvous-ha-noi
163,Khách sạn Tú Linh Palace,https://www.ivivu.com/khach-san-ha-noi/khach-san-tu-linh-palace-ha-noi
164,Hotel Des Arts - The Noble,https://www.ivivu.com/khach-san-ha-noi/khach-san-noble-boutique-ha-noi
165,Khách sạn Công Đoàn Việt Nam Hà Nội,https://www.ivivu.com/khach-san-ha-noi/khach-san-cong-doan-ha-noi
166,Khách Sạn và Spa Splendid Star Grand,https://www.ivivu.com/khach-san-ha-noi/splendid-star-grand-hotel
167,Khách sạn Little Diamond Hà Nội,https://www.ivivu.com/khach-san-ha-noi/little-hanoi-diamond
168,Khách sạn Hanoi Discovery,https://www.ivivu.com/khach-san-ha-noi/hanoi-discovery-hotel
169,Khách sạn Thiên Thai,https://www.ivivu.com/khach-san-ha-noi/thien-thai-hotel
170,Khách sạn Hà Nội Morning.,https://www.ivivu.com/khach-san-ha-noi/morning-star-hotel
171,Khách sạn Hà Nội Emotion,https://www.ivivu.com/khach-san-ha-noi/hanoi-emotion-hotel
172,Khách sạn A25 Hotel - 45 Phan Chu Trinh Hà Nội,https://www.ivivu.com/khach-san-ha-noi/a25-hotel-phan-chu-trinh
173,Hanoi House Hostel & Travel,https://www.ivivu.com/khach-san-ha-noi/hanoi-guest-house
174,Khách sạn Spa Aira Boutique Hà Nội,https://www.ivivu.com/khach-san-ha-noi/essence-hanoi-hotel-spa
175,Khách sạn Hanoi A1,https://www.ivivu.com/khach-san-ha-noi/hanoi-a1-hotel
176,Khách sạn Luxury,https://www.ivivu.com/khach-san-ha-noi/luxury-hotel
177,Khách sạn Hanoi Central Park,https://www.ivivu.com/khach-san-ha-noi/hanoi-central-park-hotel
178,Khách sạn Kingly Hà Nội,https://www.ivivu.com/khach-san-ha-noi/golden-time-hostel-2
179,Khách sạn Silk trung tâm Hà Nội,https://www.ivivu.com/khach-san-ha-noi/essence-d'orient-hotel-spa
180,Khách sạn Lucky 3 Hà Nội,https://www.ivivu.com/khach-san-ha-noi/lucky-3-hotel
181,Khách sạn Lucky 2,https://www.ivivu.com/khach-san-ha-noi/lucky-2-hotel
182,Khách sạn Sunset Westlake Hà Nội,https://www.ivivu.com/khach-san-ha-noi/sunset-westlake-hanoi-hotel
183,My Way Hotel & Residence,https://www.ivivu.com/khach-san-ha-noi/my-way-hotel-residence
184,Khách sạn Boutique & Spa Serene,https://www.ivivu.com/khach-san-ha-noi/hanoi-legacy-hotel-bat-su
185,Khách sạn Sao Mai,https://www.ivivu.com/khach-san-ha-noi/windy-hotel
186,Hanoi City Guest House,https://www.ivivu.com/khach-san-ha-noi/hanoi-city-hostel
187,Khách sạn E Central Hà Nội,https://www.ivivu.com/khach-san-ha-noi/hanoi-elegance-emerald-hotel
188,Khách sạn Văn Miếu 2,https://www.ivivu.com/khach-san-ha-noi/van-mieu-2-hotel
189,Golden Art Hotel,https://www.ivivu.com/khach-san-ha-noi/art-trendy-hotel
190,Mai Charming Hotel and Spa,https://www.ivivu.com/khach-san-ha-noi/mai-charming-boutique-hotel
191,Ambassador Hanoi Boutique Hotel & Spa,https://www.ivivu.com/khach-san-ha-noi/art-boutique-hotel-hanoi
192,Khách sạn Larosa Hà Nội,https://www.ivivu.com/khach-san-ha-noi/hanoi-larosa-hotel
193,Romantique Hotel De Hanoi,https://www.ivivu.com/khach-san-ha-noi/icon-36-hotel-residence
194,Khách sạn L'Heritage,https://www.ivivu.com/khach-san-ha-noi/celia-hotel-hanoi
195,Khách sạn Ancient Paradise Hà Nội,https://www.ivivu.com/khach-san-ha-noi/hanoi-old-town-hotel
196,Khách sạn Spring Flower,https://www.ivivu.com/khach-san-ha-noi/spring-flower-hotel
197,Khách sạn Boutique Au Coeur d'Hanoi,https://www.ivivu.com/khach-san-ha-noi/au-coeur-d'hanoi-boutique-hotel
198,Khách sạn Sunny 1,https://www.ivivu.com/khach-san-ha-noi/sunny-hotel-1
199,Khách sạn Luxeden Hà Nội,https://www.ivivu.com/khach-san-ha-noi/luxeden-hotel
200,Khách sạn A25 - 19 Phan Đình Phùng Hà Nội,https://www.ivivu.com/khach-san-ha-noi/time-square-hotel
201,Khách sạn Hanoi Posh Boutique,https://www.ivivu.com/khach-san-ha-noi/hanoi-posh-hotel
202,Khách sạn Hanoi Chic,https://www.ivivu.com/khach-san-ha-noi/hanoi-chic-hotel
203,Khách sạn Hanoi Focus,https://www.ivivu.com/khach-san-ha-noi/hanoi-focus-hotel
204,Khách sạn Hà Nội Bonsella,https://www.ivivu.com/khach-san-ha-noi/diamond-hotel-hanoi
205,Khách sạn De Syloia Hà Nội,https://www.ivivu.com/khach-san-ha-noi/de-syloia-hotel
206,Khách sạn Atrium Hà Nội,https://www.ivivu.com/khach-san-ha-noi/atrium-hanoi-hotel
207,Khách sạn Luxor Boutique Hà Nội,https://www.ivivu.com/khach-san-ha-noi/luxor-boutique-ha-noi
208,Khách sạn Eclipse Legend Hà Nội,https://www.ivivu.com/khach-san-ha-noi/eclipse-legend-hotel
209,Khách sạn Little Hà Nội,https://www.ivivu.com/khach-san-ha-noi/little-hanoi-hostel-2
210,Khách sạn Elegant Suites Westlake Hà Nội,https://www.ivivu.com/khach-san-ha-noi/elegant-suites-westlake
211,Khách sạn Hanoi Evergreen,https://www.ivivu.com/khach-san-ha-noi/hanoi-evergreen-hotel
212,Khách sạn Blue Hanoi Inn,https://www.ivivu.com/khach-san-ha-noi/blue-hanoi-inn-hotel
213,Khách sạn Bonne Nuit Hà Nội,https://www.ivivu.com/khach-san-ha-noi/eco-hanoi-hotel
214,Khách sạn Hanoi Little Town,https://www.ivivu.com/khach-san-ha-noi/ha-long-hotel
215,Khách Sạn Hà Nội Royal,https://www.ivivu.com/khach-san-ha-noi/hanoi-guest-house-royal
216,Violet Hotel,https://www.ivivu.com/khach-san-ha-noi/violet-hotel
217,Khách sạn A25 - 61 Lương Ngọc Quyến Hà Nội,https://www.ivivu.com/khach-san-ha-noi/a25-luong-ngoc-quyen-hotel
218,Khách sạn A25 - 45B Giảng Võ Hà Nội,https://www.ivivu.com/khach-san-ha-noi/a25-hotel-giang-vo
219,Khách sạn Mango Hà Nội,https://www.ivivu.com/khach-san-ha-noi/mango-hotel-hanoi
220,Khách sạn A25 - 197 Thành Nhàn Hà Nội,https://www.ivivu.com/khach-san-ha-noi/a25-hotel-thanh-nhan
221,Khách sạn Thang Long Espana,https://www.ivivu.com/khach-san-ha-noi/thang-long-espana-hotel
222,Khách sạn A25 - Đội Cấn 2 Hà Nội,https://www.ivivu.com/khach-san-ha-noi/khach-san-a25-doi-can-2
223,Khách sạn A25 - 53 Tuệ Tĩnh Hà Nội,https://www.ivivu.com/khach-san-ha-noi/a25-hotel-tue-tinh
224,Khách sạn A25 - 12 Liên Trì Hà Nội,https://www.ivivu.com/khach-san-ha-noi/a25-hotel-lien-tri
225,Hanoi Street Hotel,https://www.ivivu.com/khach-san-ha-noi/hanoi-street-hotel
226,Khách sạn A25 - 12 Ngô Sỹ Liên Hà Nội,https://www.ivivu.com/khach-san-ha-noi/a25-ngo-si-lien
227,Khách sạn A25 - 46 Châu Long Hà Nội,https://www.ivivu.com/khach-san-ha-noi/a25-hotel-chau-long
228,Khách sạn Tryst,https://www.ivivu.com/khach-san-ha-noi/tryst-hotel
229,Khách sạn A25 - Đội Cấn 1 Hà Nội,https://www.ivivu.com/khach-san-ha-noi/a25-hotel-doi-can
230,Dragon Hotel,https://www.ivivu.com/khach-san-ha-noi/dragon-hotel
231,Khách sạn Serenity Villa Hà Nội,https://www.ivivu.com/khach-san-ha-noi/serenity-villa-hotel
232,Khách sạn Sân bay Nội Bài,https://www.ivivu.com/khach-san-ha-noi/noi-bai-airport-hotel
233,Khách sạn Eco Luxury Hà Nội,https://www.ivivu.com/khach-san-ha-noi/eco-luxury-hotel-hanoi
234,Hanoi HM Boutique Hotel,https://www.ivivu.com/khach-san-ha-noi/hanoi-hm-boutique-hotel
235,Milton Boutique Hotel,https://www.ivivu.com/khach-san-ha-noi/milton-boutique-hotel
236,Khách sạn Le Foyer,https://www.ivivu.com/khach-san-ha-noi/le-foyer-hotel
237,Khách sạn Hanoi Chic,https://www.ivivu.com/khach-san-ha-noi/hanoi-chic-boutique-hotel
238,Atlanta Residences,https://www.ivivu.com/khach-san-ha-noi/atlanta-residences
239,Khách sạn Urban Alley,https://www.ivivu.com/khach-san-ha-noi/urban-alley-hotel
240,Khách sạn La Selva Hà Nội,https://www.ivivu.com/khach-san-ha-noi/hanoi-la-selva-hotel
241,Midori Boutique Hotel,https://www.ivivu.com/khach-san-ha-noi/midori-boutique-hotel
242,New Airport Hotel,https://www.ivivu.com/khach-san-ha-noi/new-airport-hotel
243,HAAP Transit Hotel,https://www.ivivu.com/khach-san-ha-noi/haap-transit-hotel
244,Khách sạn Emerald Waters Hotel & Spa Hà Nội,https://www.ivivu.com/khach-san-ha-noi/hanoi-emerald-waters-hotel-spa
245,Calidas Landmark72 Royal Residence Hanoi,https://www.ivivu.com/khach-san-ha-noi/calidas-landmark72-royal-residence-hanoi
246,Khách sạn Mely Hà Nội,https://www.ivivu.com/khach-san-ha-noi/mely-hotel
247,Khách sạn Golden Moon Suite,https://www.ivivu.com/khach-san-ha-noi/golden-moon-suite-hotel
248,Khách sạn Gallant,https://www.ivivu.com/khach-san-ha-noi/gallant-hotel
249,Khách sạn Sakura 3 Hà Nội,https://www.ivivu.com/khach-san-ha-noi/sakura-hotel-3
250,Khách sạn Bình Anh,https://www.ivivu.com/khach-san-ha-noi/binh-anh-hotel
251,Khách sạn A1 Hill Hà Nội,https://www.ivivu.com/khach-san-ha-noi/a1-hill-hanoi-hotel
252,Khách sạn và Căn hộ Dream Hà Nội,https://www.ivivu.com/khach-san-ha-noi/dream-hotel-apartment
